beer_name,brewery_name,beer_type,beer_abv,beer_ibu,comment,venue_name,venue_city,venue_state,venue_country,venue_lat,venue_lng,rating_score,created_at,checkin_url,beer_url,brewery_url,brewery_country,brewery_city,brewery_state,flavor_profiles,purchase_venue,serving_type,checkin_id,bid,brewery_id,photo_url,global_rating_score,global_weighted_rating_score,tagged_friends,total_toasts,total_comments
Cherry Dædalion,Ghost Hawk Brewing Company,Wheat Beer - Other,4,10,here for the flight war. lots of check ins. nice subtle cherry taste. would be very refreshing for the summer,The Taphouse - Wayne,Wayne,NJ,United States,40.9259,-74.2457,3.75,12/30/2020 20:17,https://untappd.com/c/981946252,https://untappd.com/beer/3169612,https://untappd.com/brewery/414485,United States,Clifton,NJ,"subtle,light,cherry",,Taster,981946252,3169612,414485,https://untappd.s3.amazonaws.com/photos/2020_12_31/5c8764439aae6297a2c8ac222dba7b6c_raw.jpg,3.77,3.76,,1,0
Bad Habits,Ghost Hawk Brewing Company,Belgian Dubbel,8,0,"def haven’t had a beer like this before. nice yet not overpowering plum taste. belgian beer taste notes like clove and spice. not my type of beer, but still a good beer",The Taphouse - Wayne,Wayne,NJ,United States,40.9259,-74.2457,3.75,12/30/2020 20:24,https://untappd.com/c/981949559,https://untappd.com/beer/4062457,https://untappd.com/brewery/414485,United States,Clifton,NJ,"clove,belgiany,raisins",,Taster,981949559,4062457,414485,https://untappd.s3.amazonaws.com/photos/2020_12_31/204697a007fc72ad92712b35a2e54ae7_raw.jpg,3.97,3.78,,1,0
Love Buzz,Ghost Hawk Brewing Company,IPA - New England,6.6,57,big new england ipa fan. especially if this one.,The Taphouse - Wayne,Wayne,NJ,United States,40.9259,-74.2457,4,12/30/2020 20:34,https://untappd.com/c/981954761,https://untappd.com/beer/4020005,https://untappd.com/brewery/414485,United States,Clifton,NJ,"clean,hoppy,Honeydew",,Taster,981954761,4020005,414485,https://untappd.s3.amazonaws.com/photos/2020_12_31/7c3f8e91c9b743ffb6bd8f8347e6b651_raw.jpg,3.96,3.78,,1,0
Ghost Hawk Lager,Ghost Hawk Brewing Company,Kellerbier / Zwickelbier,5,16,the guy was saying this tasted like a Stella. he’s def right. very clean refreshing taste,The Taphouse - Wayne,Wayne,NJ,United States,40.9259,-74.2457,3.5,12/30/2020 20:41,https://untappd.com/c/981958115,https://untappd.com/beer/3091903,https://untappd.com/brewery/414485,United States,Clifton,NJ,"light,crisp,crushable",,Taster,981958115,3091903,414485,https://untappd.s3.amazonaws.com/photos/2020_12_31/7c8bc0bd180b3a08df400f6f9bbc5543_raw.jpg,3.68,3.68,,1,0
Packanack Pils,Seven Tribesmen Brewery,Pilsner - Czech,5.6,37,clean and refreshing pils.,The Taphouse - Wayne,Wayne,NJ,United States,40.9259,-74.2457,3.75,12/30/2020 21:05,https://untappd.com/c/981969410,https://untappd.com/beer/3727276,https://untappd.com/brewery/459629,United States,Wayne,NJ,"clean,crisp,refreshing",,Taster,981969410,3727276,459629,https://untappd.s3.amazonaws.com/photos/2020_12_31/37296491e54d836c9f44d28b7c6c187c_raw.jpg,3.68,3.68,,1,0
Super Session IPA #2 (Amarillo),Lawson's Finest Liquids,IPA - Session / India Session Ale,4.8,0,def a very light crushable hoppy ipa.,Untappd at Home,,Everywhere,United States,34.2347,-77.9482,4,12/31/2020 22:11,https://untappd.com/c/982757066,https://untappd.com/beer/750461,https://untappd.com/brewery/3758,United States,Waitsfield,VT,"clean,light,hoppy",,Can,982757066,750461,3758,https://untappd.s3.amazonaws.com/photos/2021_01_01/47e7af4d809e33949fa5bbb0c0525123_raw.jpg,4.02,4.02,,0,0
The Magic Dragon,Connecticut Valley Brewing Company,Sour - Other,5.5,5,nice clean refreshing sour,Untappd at Home,,Everywhere,United States,34.2347,-77.9482,3.75,12/31/2020 23:16,https://untappd.com/c/982802595,https://untappd.com/beer/3158007,https://untappd.com/brewery/350592,United States,South Windsor,CT,"fruity,sweet,sour",,Can,982802595,3158007,350592,,3.91,3.89,,0,0
Leaves Turn,Ghost Hawk Brewing Company,Brown Ale - English,4.3,17,nice toasty and roasty flavors. the leaves already fell but it’s okay we’ll have this now (feat harley),Untappd at Home,,Everywhere,United States,34.2347,-77.9482,4,1/1/2021 22:30,https://untappd.com/c/983212500,https://untappd.com/beer/3449621,https://untappd.com/brewery/414485,United States,Clifton,NJ,"malty,roasty,smooth",,Crowler,983212500,3449621,414485,https://untappd.s3.amazonaws.com/photos/2021_01_02/4830006353661d0c232433d97835d436_raw.jpg,3.75,3.72,,0,0
Flyjack,Firestone Walker Brewing Company,IPA - Session / India Session Ale,4,25,"it’s definitely crisp and sessionable, but that doesn’t mean it should be slim on the flavor. it has some flavor but it fades quickly.",Untappd at Home,,Everywhere,United States,34.2347,-77.9482,3.25,1/3/2021 21:39,https://untappd.com/c/983996161,https://untappd.com/beer/3468594,https://untappd.com/brewery/524,United States,Paso Robles,CA,"light,crisp,Hazy",,Can,983996161,3468594,524,https://untappd.s3.amazonaws.com/photos/2021_01_04/496ac49f6346f8ba02d0e20a22690fe4_raw.jpg,3.44,3.45,,0,0
Bel Air Sour Key Lime,Brooklyn Brewery,Sour - Fruited,5.8,0,key lime is nice. just a touch of hop bitterness at the end *chef’s kiss*,Untappd at Home,,Everywhere,United States,34.2347,-77.9482,3.75,1/7/2021 21:46,https://untappd.com/c/984686861,https://untappd.com/beer/4092478,https://untappd.com/brewery/259,United States,Brooklyn,NY,"light,sour,Lime",,Bottle,984686861,4092478,259,https://untappd.s3.amazonaws.com/photos/2021_01_08/063f8e916a12cdcb6672dd937e507163_raw.jpg,3.66,3.66,,0,0
Margarita Gose,Cigar City Brewing,Sour - Fruited Gose,4.2,5,this is great. limey and citrusy and tart and bit of salt at the end. all i need now is some tequila 🤪,Untappd at Home,,Everywhere,United States,34.2347,-77.9482,4,1/8/2021 22:53,https://untappd.com/c/985103306,https://untappd.com/beer/1982592,https://untappd.com/brewery/379,United States,Tampa,FL,"sour,tart,salty",,Can,985103306,1982592,379,https://untappd.s3.amazonaws.com/photos/2021_01_09/c065f0ba9f1e2a6bb0c5d2870f50a8e5_raw.jpg,3.55,3.55,,0,0
Luponic Distortion: IPA Series No. 017,Firestone Walker Brewing Company,IPA - American,5.9,50,pleasant bitterness with some citrus and a subtle blueberry taste at the end. a nice balanced ipa,Untappd at Home,,Everywhere,United States,34.2347,-77.9482,3.5,1/9/2021 23:01,https://untappd.com/c/985654961,https://untappd.com/beer/3989000,https://untappd.com/brewery/524,United States,Paso Robles,CA,"lemony,hoppy,bitter",,Can,985654961,3989000,524,https://untappd.s3.amazonaws.com/photos/2021_01_10/6ba1a6e05a30073499d474567ce7883c_raw.jpg,3.69,3.69,,2,0
Coco-Nator,Tröegs Independent Brewing,Bock - Doppelbock,8.2,0,caramel and coconut notes and kinda light bodied. it tows the line of refreshing and heavy which is kinda cool,Untappd at Home,,Everywhere,United States,34.2347,-77.9482,3.75,1/15/2021 23:16,https://untappd.com/c/987089028,https://untappd.com/beer/3551216,https://untappd.com/brewery/2583,United States,Hershey,PA,"chocolate,coconut,caramel",,Crowler,987089028,3551216,2583,https://untappd.s3.amazonaws.com/photos/2021_01_16/1c87048143dfa34b2a4265e3edb5f11d_raw.jpg,3.89,3.85,,0,0
Brewers Ball Brut IPA With Tangerine,Last Wave Brewing Co.,IPA - Brut,6.8,0,"never had this type of ipa before. has a nice mouthfeel, citrusy and bubbly, almost has a taste of vanilla to it too. this is surprisingly refreshing",Untappd at Home,,Everywhere,United States,34.2347,-77.9482,4,1/17/2021 0:03,https://untappd.com/c/987702967,https://untappd.com/beer/4105136,https://untappd.com/brewery/342748,United States,Point Pleasant Beach,NJ,"citrusy,creamy,Tangerine",,Can,987702967,4105136,342748,https://untappd.s3.amazonaws.com/photos/2021_01_17/4e9b993fdb57592665f201a10bbbecc7_raw.jpg,3.59,3.65,,1,0
Alpenstock,Seven Tribesmen Brewery,Wheat Beer - American Pale Wheat,6.2,40,this place has got great beers. really refreshing wheat beer with subtle hop bitterness.,Seven Tribesmen Brewery,Wayne,NJ,United States,40.9229,-74.2691,4,1/20/2021 16:37,https://untappd.com/c/988465103,https://untappd.com/beer/4080400,https://untappd.com/brewery/459629,United States,Wayne,NJ,"malty,earthy,Wheat",,Draft,988465103,4080400,459629,https://untappd.s3.amazonaws.com/photos/2021_01_20/4ce2a9a9e7a92d2161cfe9d45718db56_raw.jpg,3.64,3.67,,0,0
Krampusz,Seven Tribesmen Brewery,Winter Ale,8.2,35,wow another one. the spice in this is not overpowering and compliments so well. dark and malty as well,Seven Tribesmen Brewery,Wayne,NJ,United States,40.9229,-74.2691,4,1/20/2021 16:56,https://untappd.com/c/988469170,https://untappd.com/beer/4080397,https://untappd.com/brewery/459629,United States,Wayne,NJ,"malty,warming,spiced",,Taster,988469170,4080397,459629,https://untappd.s3.amazonaws.com/photos/2021_01_20/2b31a98b8edd58d1759ee04635187d51_raw.jpg,3.87,3.75,,0,0
Hudson Hurdle,Seven Tribesmen Brewery,Sour - Fruited,5,15,delightfully tart and sour. finishes with a bit of malt. might be as good as my cranberry ginger gose 😉,Untappd at Home,,Everywhere,United States,34.2347,-77.9482,4,1/29/2021 23:15,https://untappd.com/c/991326643,https://untappd.com/beer/4044400,https://untappd.com/brewery/459629,United States,Wayne,NJ,"clean,tart,Cranberry",,Crowler,991326643,4044400,459629,https://untappd.s3.amazonaws.com/photos/2021_01_30/715efb09913620438e7408c0f8b35886_raw.jpg,3.81,3.74,,0,0
Interstellar Fog,Captain Lawrence Brewing Company,IPA - Imperial / Double New England,8.5,0,this beer is ~stellar~,Untappd at Home,,Everywhere,United States,34.2347,-77.9482,3.75,2/4/2021 21:42,https://untappd.com/c/992979836,https://untappd.com/beer/3427880,https://untappd.com/brewery/341,United States,Elmsford,NY,"floral,full,strong",,Can,992979836,3427880,341,https://untappd.s3.amazonaws.com/photos/2021_02_05/4d258cee3cd92cdb7c496871d617ac2b_raw.jpg,3.88,3.87,,0,0
Cara Cara Navel Orange Shabang,Tröegs Independent Brewing,Fruit Beer,7,0,this ones funky. borderline funky and tart which I like.,Untappd at Home,,Everywhere,United States,34.2347,-77.9482,3.5,2/5/2021 22:49,https://untappd.com/c/993470768,https://untappd.com/beer/4098960,https://untappd.com/brewery/2583,United States,Hershey,PA,"sweet,smooth,Orange",,Crowler,993470768,4098960,2583,https://untappd.s3.amazonaws.com/photos/2021_02_06/37ac5a90927397c6ce321d4778988768_raw.jpg,3.82,3.78,,0,0
Lil' Juicy,Two Roads Brewing Company,IPA - New England,5.2,0,a very light yet hoppy ipa.,Untappd at Home,,Everywhere,United States,34.2347,-77.9482,3.75,2/5/2021 23:34,https://untappd.com/c/993484330,https://untappd.com/beer/3037716,https://untappd.com/brewery/45815,United States,Stratford,CT,"light,dry-hop,juicy",,Can,993484330,3037716,45815,https://untappd.s3.amazonaws.com/photos/2021_02_06/1919ddba5dd3e3ff4950db2a127d0735_raw.jpg,3.76,3.76,,0,0
RecreationAle,Terrapin Beer Co. ,IPA - Session / India Session Ale,4.2,34,similar to previous post. very light yet flavorful ipa,Untappd at Home,,Everywhere,United States,34.2347,-77.9482,3.75,2/6/2021 22:52,https://untappd.com/c/994113928,https://untappd.com/beer/354983,https://untappd.com/brewery/1243,United States,Athens,GA,"clean,light,hoppy",,Can,994113928,354983,1243,https://untappd.s3.amazonaws.com/photos/2021_02_07/e5fe3fb6597347c77513d5b1f11c4779_raw.jpg,3.58,3.58,,0,0
Luau Krunkles,Terrapin Beer Co. ,IPA - American,6.5,38,happy 300 checkins. and what a great way to celebrate with this beer. fruity undertones with class ipa bitterness. this is good.,,,,,,,3.75,2/6/2021 23:32,https://untappd.com/c/994125505,https://untappd.com/beer/1723706,https://untappd.com/brewery/1243,United States,Athens,GA,"citrusy,fruity,hoppy",,Can,994125505,1723706,1243,https://untappd.s3.amazonaws.com/photos/2021_02_07/70f024bea7f19bd588970654d29abdeb_raw.jpg,3.75,3.75,,0,0
Brunch So Hard,Evil Genius Beer Company,IPA - New England,6.5,52,orange and citrus undertones with pleasant bitterness. also the hashtags on this can make me chuckle,Untappd at Home,,Everywhere,United States,34.2347,-77.9482,4,2/7/2021 17:59,https://untappd.com/c/994400329,https://untappd.com/beer/3999032,https://untappd.com/brewery/16170,United States,Philadelphia,PA,"hoppy,citrus,mango",,Can,994400329,3999032,16170,https://untappd.s3.amazonaws.com/photos/2021_02_07/bda641ddf979e6afe35f187cff2ba62a_raw.jpg,3.69,3.69,,2,0
Cape May IPA,Cape May Brewing Co.,IPA - American,6.3,63,nice and refreshing and floral and citrusy. if anything id want a little more hoppiness  but still good,Untappd at Home,,Everywhere,United States,34.2347,-77.9482,3.5,2/12/2021 22:43,https://untappd.com/c/995748552,https://untappd.com/beer/155721,https://untappd.com/brewery/13805,United States,Cape May,NJ,"floral,light,smooth",,Can,995748552,155721,13805,https://untappd.s3.amazonaws.com/photos/2021_02_13/481a6422d11ec226e29994059808e15a_raw.jpg,3.64,3.64,,1,0
Socks,Off Color Brewing,Farmhouse Ale - Saison,6.4,0,this is amazing. wow. funky and bright and citrusy and some maltiness on the finish.,Untappd at Home,,Everywhere,United States,34.2347,-77.9482,4.25,2/12/2021 23:27,https://untappd.com/c/995761752,https://untappd.com/beer/3494688,https://untappd.com/brewery/46709,United States,Chicago,IL,"citrusy,light,funky",,Bottle,995761752,3494688,46709,https://untappd.s3.amazonaws.com/photos/2021_02_13/2e03632aaabbad09f07402daf51ffaa4_raw.jpg,4.06,3.96,,1,0
Tasty IPA,21st Amendment Brewery,IPA - American,6.8,70,thought it would be a neipa based on description but guess not. taste is def not of a neipa — but rather a very good classic ipa. tropical and bitter notes from hops and a smooth mouthfeel. this is TASTY,Untappd at Home,,Everywhere,United States,34.2347,-77.9482,4,2/13/2021 22:46,https://untappd.com/c/996373983,https://untappd.com/beer/2250427,https://untappd.com/brewery/4339,United States,San Leandro,CA,"smooth,hoppy,bitter",,Can,996373983,2250427,4339,https://untappd.s3.amazonaws.com/photos/2021_02_14/ddacfdc14df8cb1c5a7ea44f1d19a829_raw.jpg,3.71,3.71,,2,0
Psycho Cricket Porter,Cricket Hill Brewing Co.,Porter - Other,5.4,26,my rating is more accurate than Trevor G. but that’s just my opinion. has a lot of that roasty toasty to it. towing line of being too much of that but i think that’s why i like it,Untappd at Home,,Everywhere,United States,34.2347,-77.9482,3.75,2/14/2021 0:36,https://untappd.com/c/996400236,https://untappd.com/beer/3686856,https://untappd.com/brewery/415,United States,Fairfield,NJ,"malty,roasty,coffeeish",,Can,996400236,3686856,415,https://untappd.s3.amazonaws.com/photos/2021_02_14/ffbd4daa68e193de2c979bc1370d6b1a_raw.jpg,3.66,3.68,,1,0
Morning Star,Seven Tribesmen Brewery,Blonde Ale,5.7,22,"very malty but light, just like a ✨morning star✨ (Im sorry that pun was a stretch)",Untappd at Home,,Everywhere,United States,34.2347,-77.9482,4,2/20/2021 22:51,https://untappd.com/c/998698184,https://untappd.com/beer/3832584,https://untappd.com/brewery/459629,United States,Wayne,NJ,"clean,smooth,refreshing",,Crowler,998698184,3832584,459629,https://untappd.s3.amazonaws.com/photos/2021_02_21/7297ed6cdefb721236715e2edaaa955c_raw.jpg,3.71,3.7,,0,0
Hop Gambit,Seven Tribesmen Brewery,IPA - New England,6.5,13,delightfully citrusy. for the seven tribesmen stans this is like the horizon ipa but more citrusy and THIC,Untappd at Home,,Everywhere,United States,34.2347,-77.9482,4,2/26/2021 22:24,https://untappd.com/c/1000344584,https://untappd.com/beer/4187266,https://untappd.com/brewery/459629,United States,Wayne,NJ,"creamy,hoppy,citrus",,Crowler,1000344584,4187266,459629,https://untappd.s3.amazonaws.com/photos/2021_02_27/4940769c0a17805989717b5561152f13_raw.jpg,3.94,3.85,,0,0
Julius,Tree House Brewing Company,IPA - American,6.8,72,this is wonderful. thanks @sawyer for letting me have some,Untappd at Home,,Everywhere,United States,34.2347,-77.9482,4.25,2/27/2021 21:11,https://untappd.com/c/1000990427,https://untappd.com/beer/237985,https://untappd.com/brewery/20084,United States,Charlton,MA,"tropical,smooth,hoppy",,Can,1000990427,237985,20084,,4.5,4.5,,0,0
MOOBY'S Milkshake IPA (Guava & Vanilla),Red Tank Brewing (New Jersey),IPA - Milkshake,7,0,"hops are present, guava and vanilla are present. smooth mouthfeel. nice milkshake ipa",Untappd at Home,,Everywhere,United States,34.2347,-77.9482,3.75,2/27/2021 23:50,https://untappd.com/c/1001055398,https://untappd.com/beer/4027891,https://untappd.com/brewery/339947,United States,Red Bank,NJ,"citrusy,sweet,Hazy",,Can,1001055398,4027891,339947,https://untappd.s3.amazonaws.com/photos/2021_02_28/96a5c9690ec1990d4e2e7981c10b2ec9_raw.jpg,4,3.83,,0,0
Pompton Rye Lager,Seven Tribesmen Brewery,Lager - Euro Pale,5.5,16,really refreshing yet with a touch of rye spice. this beer is honoring my town well,Seven Tribesmen Brewery,Wayne,NJ,United States,40.9229,-74.2691,4.25,3/14/2021 12:41,https://untappd.com/c/1005921812,https://untappd.com/beer/4215602,https://untappd.com/brewery/459629,United States,Wayne,NJ,"malty,spicy,clean,refreshing",,Draft,1005921812,4215602,459629,https://untappd.s3.amazonaws.com/photos/2021_03_14/29988df442eff6c08b2c2cd85184c4b3_raw.jpg,3.77,3.72,,0,0
Sea Chest,Cape May Brewing Co.,IPA - Imperial / Double New England,7.4,36,light for a double. the extra hops provide a nice tropicalness and dankness to it. im a fan.,Untappd at Home,,Everywhere,United States,34.2347,-77.9482,4,3/20/2021 21:47,https://untappd.com/c/1008276328,https://untappd.com/beer/3618617,https://untappd.com/brewery/13805,United States,Cape May,NJ,"tropical,light,bitter",,Can,1008276328,3618617,13805,https://untappd.s3.amazonaws.com/photos/2021_03_21/363f4ed62070dba5bbbe9eaa8f4e5676_raw.jpg,3.9,3.88,,0,0
New Beginnings Saison,Red Tank Brewing (New Jersey),Farmhouse Ale - Saison,5.5,0,has a nice balance of classic saison notes with subtle sweetness. nice funky balanced saison,Untappd at Home,,Everywhere,United States,34.2347,-77.9482,3.75,3/20/2021 22:58,https://untappd.com/c/1008307629,https://untappd.com/beer/3873129,https://untappd.com/brewery/339947,United States,Red Bank,NJ,"bubblegum,light,spiced",,Crowler,1008307629,3873129,339947,https://untappd.s3.amazonaws.com/photos/2021_03_21/19dfcb3499ff68f4ca8bbf2cddfe300c_raw.jpg,3.6,3.65,,0,0
Hysterical,Redemption Rock Brewing Co.,Lager - American Amber / Red,4.7,0,a neipa and a lager had a baby. it’s got notes of an Indian session ale but the lager notes come through making a hoppy lager. how hysterical 🤪,Untappd at Home,,Everywhere,United States,34.2347,-77.9482,4,3/21/2021 20:50,https://untappd.com/c/1008684706,https://untappd.com/beer/4205947,https://untappd.com/brewery/419372,United States,Worcester,MA,"sweet,smooth",,Can,1008684706,4205947,419372,https://untappd.s3.amazonaws.com/photos/2021_03_22/c2b7e6b7952199c71a2eae44d5ed29a2_raw.jpg,3.8,3.71,,1,0
Hardcastle's Irish Red,Redemption Rock Brewing Co.,Red Ale - Irish,5.1,17,nice and malty and toasty roasty,Untappd at Home,,Everywhere,United States,34.2347,-77.9482,4,3/25/2021 20:36,https://untappd.com/c/1009482788,https://untappd.com/beer/3118417,https://untappd.com/brewery/419372,United States,Worcester,MA,"malty,light,sweetness",,Can,1009482788,3118417,419372,https://untappd.s3.amazonaws.com/photos/2021_03_26/4b73485fe1078a27e00be69a78021db5_raw.jpg,3.79,3.74,,1,0
Poms Not Bombs,Redemption Rock Brewing Co.,Sour - Fruited,5,0,"taste the pom, taste the grapefruit, taste the cinnamon. sour but not too sour. light finish. this is THE BOMB",Untappd at Home,,Everywhere,United States,34.2347,-77.9482,4,3/26/2021 23:09,https://untappd.com/c/1010042787,https://untappd.com/beer/4187153,https://untappd.com/brewery/419372,United States,Worcester,MA,"grapefruity,sour,cinnamon",,Crowler,1010042787,4187153,419372,https://untappd.s3.amazonaws.com/photos/2021_03_27/caa17c41c90ab74d31cee663c954b343_raw.jpg,3.73,3.7,,1,0
Freya's Choice,Seven Tribesmen Brewery,Pale Ale - American,5.3,10,kind of a lighter hop gambit from this place. sweet and hoppy but not too hoppy. it may be freya’s choice but it’s also mine 🤪,Seven Tribesmen Brewery,Wayne,NJ,United States,40.9229,-74.2691,4,3/27/2021 13:41,https://untappd.com/c/1010227366,https://untappd.com/beer/4225933,https://untappd.com/brewery/459629,United States,Wayne,NJ,fruity,,Can,1010227366,4225933,459629,https://untappd.s3.amazonaws.com/photos/2021_03_27/c58d76dc6656e10cd4dbecd7cfe16756_raw.jpg,3.94,3.76,,0,0
Dragan Stout,Seven Tribesmen Brewery,Stout - Irish Dry,4.6,40,nice toasty toasty taste. didn’t have coffee yet so the taste is making me feel something. i don’t have a pun for this one so just enjoy the post,Seven Tribesmen Brewery,Wayne,NJ,United States,40.9229,-74.2691,4,3/27/2021 14:02,https://untappd.com/c/1010245809,https://untappd.com/beer/3727283,https://untappd.com/brewery/459629,United States,Wayne,NJ,"malty,roasty,coffee",,Draft,1010245809,3727283,459629,https://untappd.s3.amazonaws.com/photos/2021_03_27/2abd9516cbac86f9354163dea1844040_raw.jpg,3.82,3.76,,0,0
Rickey Nelson,Redemption Rock Brewing Co.,Sour - Fruited,4.2,0,funky sour. limey and tart and the dry hops give it some subtle bitterness. this is niceeee,Untappd at Home,,Everywhere,United States,34.2347,-77.9482,4,4/2/2021 22:47,https://untappd.com/c/1012688092,https://untappd.com/beer/4246589,https://untappd.com/brewery/419372,United States,Worcester,MA,"sour,Lime,Berries",,Crowler,1012688092,4246589,419372,https://untappd.s3.amazonaws.com/photos/2021_04_03/f428bdf78de7f344d5f7456555bcd9b5_raw.jpg,3.87,3.74,,3,0
The Bees,Redemption Rock Brewing Co.,Wheat Beer - Other,4.5,11,definitely has those wheat beer notes. has a zip just like a bee sting 🤪,Untappd at Home,,Everywhere,United States,34.2347,-77.9482,3.75,4/2/2021 23:23,https://untappd.com/c/1012699876,https://untappd.com/beer/3139964,https://untappd.com/brewery/419372,United States,Worcester,MA,"grainy,honey,Hazy",,Can,1012699876,3139964,419372,https://untappd.s3.amazonaws.com/photos/2021_04_03/48ed0249ac9c755e5e4aeda2a876e4c9_raw.jpg,3.55,3.63,,2,0
The Birds,Redemption Rock Brewing Co.,IPA - Imperial / Double New England,8.3,0,light for a double. just like a bird haha,Untappd at Home,,Everywhere,United States,34.2347,-77.9482,4,4/3/2021 22:52,https://untappd.com/c/1013356410,https://untappd.com/beer/3740784,https://untappd.com/brewery/419372,United States,Worcester,MA,"aromatic,tropical,hoppy",,Can,1013356410,3740784,419372,https://untappd.s3.amazonaws.com/photos/2021_04_04/4efc6f37932aedb11549e81714b889ea_raw.jpg,3.86,3.75,,3,0
Smithwick's,Guinness,Red Ale - Irish,4.5,0,malty but kind of lighter than I was hoping. Still refreshing though.,Thatcher McGhee's,Pompton Lakes,NJ,United States,41.0076,-74.2951,3.25,4/5/2021 20:51,https://untappd.com/c/1014041156,https://untappd.com/beer/13388,https://untappd.com/brewery/49,Ireland,Saint James' Gate,Leinster,"malty,light,dark",,Draft,1014041156,13388,49,https://untappd.s3.amazonaws.com/photos/2021_04_06/1722a37c2c2c6e78a959f317dcbe59be_raw.jpg,3.54,3.54,,1,0
Pines Lake Pils,Seven Tribesmen Brewery,Pilsner - German,5.5,33,nice malty refreshing pils.,Seven Tribesmen Brewery,Wayne,NJ,United States,40.9229,-74.2691,4.25,4/10/2021 17:41,https://untappd.com/c/1015758633,https://untappd.com/beer/4225945,https://untappd.com/brewery/459629,United States,Wayne,NJ,"malty,clean,refreshing",,Draft,1015758633,4225945,459629,https://untappd.s3.amazonaws.com/photos/2021_04_10/7995ec6e5011bef5907f15596314ec0d_raw.jpg,3.74,3.71,,2,0
Tiramisu Milk Porter,Czig Meister,Porter - Other,5.2,0,tiramisu is my favorite dessert so I was very excited for this. the coffee and chocolate taste is there but was hoping for a little more sweetness/vanilla/milky taste. nice and roasty toasty. would drink again though.,Untappd at Home,,Everywhere,United States,34.2347,-77.9482,3.5,4/17/2021 23:30,https://untappd.com/c/1018407836,https://untappd.com/beer/2507448,https://untappd.com/brewery/228703,United States,Hackettstown,NJ,"smooth,coffee,chocolate",,Can,1018407836,2507448,228703,https://untappd.s3.amazonaws.com/photos/2021_04_18/678df3182168321d3a31e104332afa1f_raw.jpg,3.76,3.76,,0,0
Sea Chant,Seven Tribesmen Brewery,Sour - Fruited,5.8,8,the sweetness from the guava is subtle and compliments the tart clean sour taste well. im CHANTING for how good this is,Untappd at Home,,Everywhere,United States,34.2347,-77.9482,3.75,4/23/2021 22:52,https://untappd.com/c/1020173480,https://untappd.com/beer/4265286,https://untappd.com/brewery/459629,United States,Wayne,NJ,"fruity,tart,Guava",,Crowler,1020173480,4265286,459629,https://untappd.s3.amazonaws.com/photos/2021_04_24/57064247feb72233c7f3b5367f09f8a9_raw.jpg,3.89,3.77,,1,0
Grapefruit Crushin' It,Cape May Brewing Co.,IPA - American,8,15,"like the orange crushin it, but grapefruit. Pleasantly bitter and citrusy",Untappd at Home,,Everywhere,United States,34.2347,-77.9482,4,4/28/2021 21:48,https://untappd.com/c/1021945214,https://untappd.com/beer/3531960,https://untappd.com/brewery/13805,United States,Cape May,NJ,"citrusy,grapefruity,sharp",,Can,1021945214,3531960,13805,https://untappd.s3.amazonaws.com/photos/2021_04_29/064e4a18d497b33a6a57abf14e1f6c0a_raw.jpg,3.77,3.76,,0,0
Always Ready,Cape May Brewing Co.,Pale Ale - American,4.8,23,"zesty, juicy, refreshing. toeing line of being too hoppy for a pale ale which i like. i will now be ALWAYS READY for this (someone make me stop these puns)",Untappd at Home,,Everywhere,United States,34.2347,-77.9482,4,4/30/2021 22:38,https://untappd.com/c/1022755285,https://untappd.com/beer/2503694,https://untappd.com/brewery/13805,United States,Cape May,NJ,"tropical,juicy,crisp",,Can,1022755285,2503694,13805,https://untappd.s3.amazonaws.com/photos/2021_05_01/3e9898cf2c58aeea101a3a97451c2d83_raw.jpg,3.68,3.68,,1,0
