beer_name,brewery_name,beer_type,beer_abv,beer_ibu,comment,venue_name,venue_city,venue_state,venue_country,venue_lat,venue_lng,rating_score,created_at,checkin_url,beer_url,brewery_url,brewery_country,brewery_city,brewery_state,flavor_profiles,purchase_venue,serving_type,checkin_id,bid,brewery_id,photo_url,global_rating_score,global_weighted_rating_score,tagged_friends,total_toasts,total_comments
Cranberry Gose,Long Trail Brewing Company,Sour - Gose,5.2,8,salt is not as pronounced but otherwise very good.,The Shepherd & The Knucklehead Pub,Haledon,NJ,United States,40.9413,-74.1854,3.75,1/20/2020 16:51,https://untappd.com/c/857491764,https://untappd.com/beer/1371506,https://untappd.com/brewery/801,United States,Bridgewater Corners,VT,,,,857491764,1371506,801,https://untappd.s3.amazonaws.com/photos/2020_01_20/1ae23cf04fd0bb98a5bbfafadf6d7448_raw.jpg,3.59,3.59,,0,0
Thatcher's Irish Red Ale,Thatcher Macghee's,Red Ale - Irish,4.9,0,"nothing crazy about, but would def have again",Thatcher McGhee's,Pompton Lakes,NJ,United States,41.0076,-74.2951,3,1/30/2020 20:49,https://untappd.com/c/860754361,https://untappd.com/beer/1589640,https://untappd.com/brewery/275288,United States,Pompton Lakes,NJ,,,Draft,860754361,1589640,275288,,3.55,3.61,,0,0
Marble of Doom,KCBC - Kings County Brewers Collective,Sour - Fruited,5.5,0,first off it’s served in a wine glass so I feel fancy af. second this is exactly how a sour beer should be — very tart with beer taste,District Tap House,New York,NY,United States,40.7542,-73.9904,4,2/8/2020 19:02,https://untappd.com/c/864619952,https://untappd.com/beer/1974100,https://untappd.com/brewery/167520,United States,Brooklyn,NY,,,Draft,864619952,1974100,167520,https://untappd.s3.amazonaws.com/photos/2020_02_09/18a84de180f60b55dcd6841e15db56f4_raw.jpg,3.95,3.94,,1,0
Tiny Juicy IPA,Five Boroughs Brewing Co.,IPA - Session / India Session Ale,4.2,45,"starts out at with a very hoppy taste and then mellows and calms, which I enjoyed",District Tap House,New York,NY,United States,40.7542,-73.9904,3.75,2/8/2020 19:29,https://untappd.com/c/864645267,https://untappd.com/beer/2794120,https://untappd.com/brewery/315131,United States,Brooklyn,NY,,,Draft,864645267,2794120,315131,https://untappd.s3.amazonaws.com/photos/2020_02_09/ee44a06cd13053471e7a8728eed642a8_raw.jpg,3.73,3.73,,1,0
Prayer Group,Tired Hands Brewing Company,Lager - Pale,4.1,0,haven’t had a lot of beers of this type of the ones i did have this is the best,District Tap House,New York,NY,United States,40.7542,-73.9904,3.75,2/8/2020 20:13,https://untappd.com/c/864684413,https://untappd.com/beer/2049015,https://untappd.com/brewery/6226,United States,Ardmore,PA,,,Draft,864684413,2049015,6226,https://untappd.s3.amazonaws.com/photos/2020_02_09/bd6f3d20c43b6b9a3a656586b8077df1_raw.jpg,3.66,3.66,,1,0
Fiddlehead IPA,Fiddlehead Brewing Company,IPA - American,6.2,53,"has an interesting spice to it, but im all about it",District Tap House,New York,NY,United States,40.7542,-73.9904,3.75,2/8/2020 20:56,https://untappd.com/c/864718492,https://untappd.com/beer/96969,https://untappd.com/brewery/18518,United States,Shelburne,VT,,,Draft,864718492,96969,18518,https://untappd.s3.amazonaws.com/photos/2020_02_09/d554f3b337007f6b8ab2983c97e057b5_raw.jpg,3.92,3.92,,1,0
All City,Interboro Spirits & Ales,Lager - Vienna,5,35,a hoppier Stella,District Tap House,New York,NY,United States,40.7542,-73.9904,3.75,2/8/2020 23:03,https://untappd.com/c/864794457,https://untappd.com/beer/3577962,https://untappd.com/brewery/279573,United States,Brooklyn,NY,,,Draft,864794457,3577962,279573,https://untappd.s3.amazonaws.com/photos/2020_02_09/e44a7e680f85889a67dbbfd9b3396c21_raw.jpg,3.71,3.71,,1,0
Checker Cab Blonde Ale,Chelsea Craft Brewing Company,Kölsch,5,0,Jerry S. said it’s okay to rate beer you make if it’s a clone brew so here’s to my first homebrew,,,,,,,3.5,2/11/2020 22:02,https://untappd.com/c/865579752,https://untappd.com/beer/1768,https://untappd.com/brewery/374,United States,Bronx,NY,,,Draft,865579752,1768,374,https://untappd.s3.amazonaws.com/photos/2020_02_12/4b02bd1b5746a7898915f4fa525a4d79_raw.jpg,3.23,3.26,,1,0
Stone Ghost Hammer IPA,Stone Brewing,IPA - American,6.7,56,nice level of hops 🐸 (ha ha get it because it’s a frog),Anthony's Coal Fired Pizza,Wayne,NJ,United States,40.9392,-74.2694,3.75,2/14/2020 20:05,https://untappd.com/c/866538418,https://untappd.com/beer/2038798,https://untappd.com/brewery/1204,United States,Escondido,CA,hoppy,,Draft,866538418,2038798,1204,https://untappd.s3.amazonaws.com/photos/2020_02_15/45316586e785d0727ee25599f4c9b81f_raw.jpg,3.72,3.72,,0,0
Original Ritterguts Gose,Ritterguts Gose,Sour - Gose,4.7,11,got this when i was in the homeland. puts all other goses to shame (which makes sense since i bought it where they originated),,,,,,,4,2/14/2020 23:22,https://untappd.com/c/866655043,https://untappd.com/beer/331458,https://untappd.com/brewery/300168,Germany,,,,,,866655043,331458,300168,https://untappd.s3.amazonaws.com/photos/2020_02_15/b173b1941be91799786d2594de9ff36f_raw.jpg,3.61,3.62,,0,0
Slightly Mighty,Dogfish Head Craft Brewery,IPA - Session / India Session Ale,4,30,i know this is an Indian session ale but it has more mellow hop flavor than I thought it would. It lingers longer than expected though,Thatcher McGhee's,Pompton Lakes,NJ,United States,41.0076,-74.2951,3.25,2/16/2020 22:00,https://untappd.com/c/867925611,https://untappd.com/beer/2994694,https://untappd.com/brewery/459,United States,Milton,DE,,,,867925611,2994694,459,https://untappd.s3.amazonaws.com/photos/2020_02_17/64237a64d550a4fa90089fc0679e544d_raw.jpg,3.5,3.5,,1,0
Shiner Bock,Spoetzl Brewery,Bock - Single / Traditional,4.4,13,it’s aight,,,,,,,3,2/21/2020 22:09,https://untappd.com/c/869519916,https://untappd.com/beer/4488,https://untappd.com/brewery/1179,United States,Shiner,TX,,,,869519916,4488,1179,https://untappd.s3.amazonaws.com/photos/2020_02_22/5142c153ab43f82987e86ad86f1528d2_raw.jpg,3.49,3.49,,0,0
Raspberry Provincial,Funkwerks,Sour - Other,4.2,0,not as sour as expected but good.,The Shepherd & The Knucklehead Pub,Haledon,NJ,United States,40.9413,-74.1854,3.25,3/2/2020 20:00,https://untappd.com/c/873680330,https://untappd.com/beer/582210,https://untappd.com/brewery/8946,United States,Fort Collins,CO,,,,873680330,582210,8946,https://untappd.s3.amazonaws.com/photos/2020_03_03/c77d96c6d200ed97450854b5c15413aa_raw.jpg,3.78,3.78,,1,0
Kardigan,Alementary Brewing Company,Altbier,5.7,41,my first alt. we have our first alt in the keg so this is a good pregame. waitress said this keg kicked but this made me happy,The Shepherd & The Knucklehead Pub,Haledon,NJ,United States,40.9413,-74.1854,3.75,3/2/2020 20:27,https://untappd.com/c/873687939,https://untappd.com/beer/1905105,https://untappd.com/brewery/262130,United States,Hackensack,NJ,,,,873687939,1905105,262130,https://untappd.s3.amazonaws.com/photos/2020_03_03/39bb99e85be3312dbefae4c180d71891_raw.jpg,3.63,3.65,,1,0
Devils Woo! Brew,Magic Hat Brewing Company,IPA - Session / India Session Ale,4.8,0,"well balanced flavor. hoppy, malty, refreshing. im a fan.",Applebee's Grill + Bar,Butler,NJ,United States,40.9906,-74.3368,3.75,3/4/2020 22:02,https://untappd.com/c/874163313,https://untappd.com/beer/3462497,https://untappd.com/brewery/812,United States,South Burlington,VT,,,,874163313,3462497,812,https://untappd.s3.amazonaws.com/photos/2020_03_05/d33f8e234bf812d9d04008bed6e3fb1d_raw.jpg,3.62,3.64,,0,0
Otter Creek Copper Ale,Otter Creek Brewing,Altbier,5,25,this brew is no longer in production but we keeping it alive by brewing the clone of it 👀🥴,,,,,,,3.5,3/5/2020 21:49,https://untappd.com/c/874453017,https://untappd.com/beer/6664,https://untappd.com/brewery/959,United States,Middlebury,VT,,,,874453017,6664,959,https://untappd.s3.amazonaws.com/photos/2020_03_06/508daa816ceffc9c3ca310d2616d2876_raw.jpg,3.33,3.34,,1,0
Ramstein Double Platinum Blonde,High Point Brewing Company (New Jersey),Bock - Weizenbock,7,0,very very smooth. a hoppier blue moon,Applebee's Grill + Bar,Butler,NJ,United States,40.9906,-74.3368,3.75,3/11/2020 22:13,https://untappd.com/c/876924512,https://untappd.com/beer/46871,https://untappd.com/brewery/4233,United States,Butler,NJ,,,,876924512,46871,4233,https://untappd.s3.amazonaws.com/photos/2020_03_12/c587df26b6945dbb00c4f3918d38709d_raw.jpg,3.72,3.72,,2,0
Guinness Draught,Guinness,Stout - Irish Dry,4.2,45,as a note my father poured me a half and half so im rating these based off the overall taste of what i can taste of each,,,,,,,3.75,3/16/2020 20:45,https://untappd.com/c/878917784,https://untappd.com/beer/4473,https://untappd.com/brewery/49,Ireland,Saint James' Gate,Leinster,,,,878917784,4473,49,https://untappd.s3.amazonaws.com/photos/2020_03_17/6abf9efb80c6c5ac80bc3f0b3839c11a_raw.jpg,3.78,3.78,,1,0
Bass Pale Ale,Bass Brewers,Pale Ale - English,5,49,see previous.,,,,,,,3.25,3/16/2020 20:47,https://untappd.com/c/878918237,https://untappd.com/beer/5872,https://untappd.com/brewery/85,England,Shamlesbury,Lancashire,,,,878918237,5872,85,https://untappd.s3.amazonaws.com/photos/2020_03_17/c9133f74827a816b0f2f55c4a378a47a_raw.jpg,3.32,3.32,,1,0
60 Minute IPA,Dogfish Head Craft Brewery,IPA - American,6,60,thankful this came out good because brewing this was annoying (ran out of hop bags and you add A LOT of hops). quite delightful,,,,,,,4,3/17/2020 20:47,https://untappd.com/c/879135151,https://untappd.com/beer/3952,https://untappd.com/brewery/459,United States,Milton,DE,,,,879135151,3952,459,https://untappd.s3.amazonaws.com/photos/2020_03_18/8de2aae3137e4fb666735590cf9f226f_raw.jpg,3.85,3.85,,2,0
Detour,Muskoka Brewery,IPA - Session / India Session Ale,4.3,38,haven’t posted in awhile. hello friends.  i would take a detour for this beer. starts with a mellow subtle flavor but then finishes with a balanced level of hops and slight sweetness,,,,,,,3.5,4/9/2020 21:38,https://untappd.com/c/885160871,https://untappd.com/beer/538899,https://untappd.com/brewery/3727,Canada,Bracebridge,ON,,,,885160871,538899,3727,https://untappd.s3.amazonaws.com/photos/2020_04_10/53a5c120be1f3446c3f396c9a9cb053e_raw.jpg,3.64,3.64,,2,2
Midnight Lager,Stella Artois,Lager - Euro Dark,5.4,18,kinda like the schwarzbier i had in germany. like a regular stella but a lot maltier and deeper in flavor,Untappd at Home,,Everywhere,United States,34.2347,-77.9482,3.5,4/14/2020 20:50,https://untappd.com/c/886737168,https://untappd.com/beer/3481735,https://untappd.com/brewery/265,Belgium,Leuven,Vlaanderen,,,,886737168,3481735,265,https://untappd.s3.amazonaws.com/photos/2020_04_15/d9d198567d9319be0d161b9ba717a924_raw.jpg,3.57,3.57,,2,3
Super Cluster,Lagunitas Brewing Company,IPA - Imperial / Double,8,60,Trevor handed me this so I had to have it. Glad he handed it to me because this has fantastic flavor. Some citrus notes from the hops that carries through the whole sip. Thank you Trevor,Untappd at Home,,Everywhere,United States,34.2347,-77.9482,3.75,4/15/2020 19:15,https://untappd.com/c/886889347,https://untappd.com/beer/2698527,https://untappd.com/brewery/765,United States,Petaluma,CA,,,,886889347,2698527,765,https://untappd.s3.amazonaws.com/photos/2020_04_15/d2b07c574754d24c50f2714edd8896e9_raw.jpg,3.84,3.84,,1,0
Black IPA (2017),Sierra Nevada Brewing Co.,IPA - Black / Cascadian Dark Ale,6.9,60,my father needs to clean out fridge better. despite being older and no longer in production it’s still okay. im just trying to clean out the fridge so we can fit more home brew. don’t drink older beer regularly friends,Untappd at Home,,Everywhere,United States,34.2347,-77.9482,3,4/16/2020 21:13,https://untappd.com/c/887145520,https://untappd.com/beer/1887283,https://untappd.com/brewery/1142,United States,Chico,CA,,,,887145520,1887283,1142,https://untappd.s3.amazonaws.com/photos/2020_04_17/c7da9286f96937095ddd38007e5675b4_raw.jpg,3.66,3.66,,1,0
Voodoo Ranger American Haze,New Belgium Brewing Company,IPA - New England,5,30,"if you’re looking for a very hoppy ipa, this is not the one you’d drink. if you’re looking for a citrusy, refreshing, and “crushable” ipa (as the can says), this is the one for you. good brew",Untappd at Home,,Everywhere,United States,34.2347,-77.9482,3.5,4/18/2020 21:33,https://untappd.com/c/888054684,https://untappd.com/beer/3564053,https://untappd.com/brewery/905,United States,Fort Collins,CO,"grapefruity,Hazy",,,888054684,3564053,905,https://untappd.s3.amazonaws.com/photos/2020_04_19/39b248fe9281e69d97d1c801fa2755fd_raw.jpg,3.66,3.66,,2,0
Watermelon Gose,Terrapin Beer Co. ,Sour - Fruited Gose,4.5,7,it tastes identical to a green zebra so therefore it’s rated the same,Untappd at Home,,Everywhere,United States,34.2347,-77.9482,4,4/23/2020 21:39,https://untappd.com/c/889196876,https://untappd.com/beer/1559097,https://untappd.com/brewery/1243,United States,Athens,GA,,,Can,889196876,1559097,1243,https://untappd.s3.amazonaws.com/photos/2020_04_24/33f62c427999c0d08a57c02d86a7f8a1_raw.jpg,3.68,3.68,,0,0
Steenbrugge Blanche,Brouwerij Palm,Wheat Beer - Witbier,5,11,"i think this was the right one. it’s belgian so i can’t tell.  regardless, another home brew complete. tastes almost like a blue moon and an angry orchard had a baby. it starts like a blue moon and finishes like an angry orchard.",Untappd at Home,,Everywhere,United States,34.2347,-77.9482,3.25,4/25/2020 21:17,https://untappd.com/c/890128426,https://untappd.com/beer/40022,https://untappd.com/brewery/967,Belgium,Steenhuffel,Vlaanderen,,,,890128426,40022,967,https://untappd.s3.amazonaws.com/photos/2020_04_26/7a1f81c4d0b06fa3cfe1ec413e45a5ee_raw.jpg,3.36,3.37,,1,0
Sparkling Lime Lager,New Belgium Brewing Company,Lager - American Light,4.4,10,basically a canned corona with a lime. which is nice because it creates less work for me because when i try to mix lime the corona it sprays everywhere so yay thanks new belgium,Untappd at Home,,Everywhere,United States,34.2347,-77.9482,3.25,4/25/2020 23:31,https://untappd.com/c/890178467,https://untappd.com/beer/2802327,https://untappd.com/brewery/905,United States,Fort Collins,CO,,,,890178467,2802327,905,https://untappd.s3.amazonaws.com/photos/2020_04_26/e3a5741886c58ecb2aa0f982a37489ae_raw.jpg,3.45,3.46,,1,0
Liquid Truth Serum,Dogfish Head Craft Brewery,IPA - American,7,65,"the truth about this beer is that it’s damn good. hoppy but not overwhelmingly hoppy, refreshing and crisp, i like it.",Untappd at Home,,Everywhere,United States,34.2347,-77.9482,4,4/26/2020 21:23,https://untappd.com/c/890487334,https://untappd.com/beer/2008972,https://untappd.com/brewery/459,United States,Milton,DE,,,,890487334,2008972,459,https://untappd.s3.amazonaws.com/photos/2020_04_27/499bc26996ec374db6ec672d823a05f6_raw.jpg,3.86,3.86,,0,0
Vibrant P'ocean,Dogfish Head Craft Brewery,Sour - Fruited,4.7,12,it tastes ALMOST as good as the marble of doom (@myloyalfollowers look back for that post for reference),Untappd at Home,,Everywhere,United States,34.2347,-77.9482,3.75,4/27/2020 20:13,https://untappd.com/c/890670028,https://untappd.com/beer/3578749,https://untappd.com/brewery/459,United States,Milton,DE,,,,890670028,3578749,459,https://untappd.s3.amazonaws.com/photos/2020_04_28/33ac378f0f7515684dff77273c97e693_raw.jpg,3.47,3.47,,0,0
The IPA,Blue Point Brewing Company,IPA - American,6,43,"as the can says, “unlike any other”. def one of the more citrusy IPAs ive had",,,,,,,3.5,4/30/2020 21:20,https://untappd.com/c/891336201,https://untappd.com/beer/3001060,https://untappd.com/brewery/144,United States,Patchogue,NY,"citrusy,light",,Can,891336201,3001060,144,https://untappd.s3.amazonaws.com/photos/2020_05_01/3fb46b8ed608a138c1294a74e1269e41_raw.jpg,3.54,3.55,,1,0
Sun Kissed Citra,Jersey Girl Brewing,IPA - New England,5.5,0,“new england” gives it a bit of pine and the hops give it a citrus feel. i like it. hopefully i can have it at the actually brewery after work soon :/,Untappd at Home,,Everywhere,United States,34.2347,-77.9482,3.75,5/11/2020 21:22,https://untappd.com/c/894940693,https://untappd.com/beer/1796415,https://untappd.com/brewery/194453,United States,Hackettstown,NJ,citrus,,,894940693,1796415,194453,https://untappd.s3.amazonaws.com/photos/2020_05_12/b56a302217ff88fc3f6a8ac7456c8b6c_raw.jpg,3.65,3.66,,0,0
Hell or High Watermelon,21st Amendment Brewery,Wheat Beer - Other,4.9,17,skeptical at first because watermelon and wheat are delicate flavors but i like this. just a touch of sweetness from the watermelon with the classic wheat taste at the end. v refreshing. sorry i didn’t have this til now ive seen so many have it,Untappd at Home,,Everywhere,United States,34.2347,-77.9482,3.5,5/23/2020 22:02,https://untappd.com/c/898979649,https://untappd.com/beer/7044,https://untappd.com/brewery/4339,United States,San Leandro,CA,,,,898979649,7044,4339,https://untappd.s3.amazonaws.com/photos/2020_05_24/6b579915bfc0b63854f811b51d4f05c9_raw.jpg,3.51,3.51,,1,0
Orange Crushin' It,Cape May Brewing Co.,IPA - American,8,15,basically an orange juice meets an ipa. aroma and taste are really refreshing. unlike the name says though don’t “crush” these as it’s 8% be careful my friends,Untappd at Home,,Everywhere,United States,34.2347,-77.9482,4,5/24/2020 22:10,https://untappd.com/c/899406001,https://untappd.com/beer/2808541,https://untappd.com/brewery/13805,United States,Cape May,NJ,,,,899406001,2808541,13805,https://untappd.s3.amazonaws.com/photos/2020_05_25/5bddb8ac546ee84b6b133c7641c74bc0_raw.jpg,3.85,3.85,,0,0
Guayabera,Cigar City Brewing,Pale Ale - American,5.5,50,"surprised it’s considered a reg pale ale and not an ipa because it tastes hoppier than expected, but nonetheless citrusy and refreshing",Untappd at Home,,Everywhere,United States,34.2347,-77.9482,3.5,6/3/2020 21:16,https://untappd.com/c/902405588,https://untappd.com/beer/830537,https://untappd.com/brewery/379,United States,Tampa,FL,,,,902405588,830537,379,https://untappd.s3.amazonaws.com/photos/2020_06_04/e0f748c354985b4468bddaf7ad6f1358_raw.jpg,3.72,3.72,,0,0
Traditional Lager,Yuengling Brewery,Lager - American Amber / Red,4.5,16,zach drinking a non-craft beer? unheard of.,Untappd at Home,,Everywhere,United States,34.2347,-77.9482,3.25,6/4/2020 22:43,https://untappd.com/c/902683098,https://untappd.com/beer/16649,https://untappd.com/brewery/1976,United States,Pottsville,PA,,,,902683098,16649,1976,https://untappd.s3.amazonaws.com/photos/2020_06_05/0a4f101e8ddac2c23a61f6957f55a154_raw.jpg,3.49,3.49,,0,0
Paprika Ale,Seven Tribesmen Brewery,Red Ale - American Amber / Red,5,43,yes — theres literally paprika in this beer! and you def taste it! but it adds more spice and a hint of sweetness to a slightly hoppy brew. im a fan,,,,,,,3.75,6/7/2020 21:55,https://untappd.com/c/904166162,https://untappd.com/beer/3727291,https://untappd.com/brewery/459629,United States,Wayne,NJ,peppery,,,904166162,3727291,459629,https://untappd.s3.amazonaws.com/photos/2020_06_08/af03de8b3b24766d3685410541b69d04_raw.jpg,3.65,3.66,,0,0
Sundial Series - Sunset Sherbet Sour IPA,Czig Meister,IPA - Sour,6.2,24,"phenomenal. absolutely phenomenal. as the name says it tastes like sherbet id have as a kid, coupled with an ipa i have grown to like in recent times. the bitter hops and sour fruits balance each other so well.",,,,,,,4,6/8/2020 21:19,https://untappd.com/c/904343184,https://untappd.com/beer/2810404,https://untappd.com/brewery/228703,United States,Hackettstown,NJ,,,,904343184,2810404,228703,https://untappd.s3.amazonaws.com/photos/2020_06_09/325880e2e504335ad5e96e946876d9ce_raw.jpg,4.02,3.94,,0,0
The Gardener,Czig Meister,Farmhouse Ale - Saison,4.3,13,this brew is REFRESHING. strong lemon flavor and then a mellow basil flavor at the end. basically a boujee summer shandy,,,,,,,3.75,6/9/2020 20:31,https://untappd.com/c/904528584,https://untappd.com/beer/2270303,https://untappd.com/brewery/228703,United States,Hackettstown,NJ,,,,904528584,2270303,228703,https://untappd.s3.amazonaws.com/photos/2020_06_10/efbd5eaff635ec948ee96ed6b1d61bd5_raw.jpg,3.57,3.6,,0,0
Talisman,Seven Tribesmen Brewery,IPA - American,6.6,60,a little sweet. a little spicy. very bitter. ironically balanced.,,,,,,,3.5,6/14/2020 21:33,https://untappd.com/c/906693438,https://untappd.com/beer/3694566,https://untappd.com/brewery/459629,United States,Wayne,NJ,,,,906693438,3694566,459629,https://untappd.s3.amazonaws.com/photos/2020_06_15/5613f139224a5ee399aad32ff9b2be37_raw.jpg,3.62,3.65,,1,0
Trebuchet Saison,Seven Tribesmen Brewery,Farmhouse Ale - Saison,6,28,it’s ok. for a saison i was expecting it to be a bit more herby or fruity and it’s more subtle than i was expecting. still drinkable and good though,,,,,,,3.25,6/15/2020 20:38,https://untappd.com/c/906875196,https://untappd.com/beer/3727270,https://untappd.com/brewery/459629,United States,Wayne,NJ,,,,906875196,3727270,459629,https://untappd.s3.amazonaws.com/photos/2020_06_16/e8a5eddb0caf6a0b190b191a257450bd_raw.jpg,3.65,3.67,,0,0
Voodoo Ranger Xperimental IPA #1 Citra,New Belgium Brewing Company,IPA - American,6.6,27,citrus aroma. mellow hop level. crisp and refreshing. why does this sound like an advertisement? i dont know. but what i do know is that they should upgrade this brew from xperimental to xtremely delicious (sorry i dont know what im saying),,,,,,,3.75,6/16/2020 21:21,https://untappd.com/c/907099918,https://untappd.com/beer/3673551,https://untappd.com/brewery/905,United States,Fort Collins,CO,,,,907099918,3673551,905,https://untappd.s3.amazonaws.com/photos/2020_06_17/316f0f714c57b09325c67dfad462f5d1_raw.jpg,3.74,3.74,,0,0
SuperEIGHT,Dogfish Head Craft Brewery,Sour - Fruited Gose,5.3,0,it is now my mission to try all goses. this ones SUPER,,,,,,,3.75,6/17/2020 21:45,https://untappd.com/c/907355780,https://untappd.com/beer/2903270,https://untappd.com/brewery/459,United States,Milton,DE,,,,907355780,2903270,459,https://untappd.s3.amazonaws.com/photos/2020_06_18/cc0e20e441dd193994e0f0c086f07cae_raw.jpg,3.65,3.65,,1,0
Juice Bomb,Sloop Brewing Co.,IPA - New England,6.5,0,this ipa is JUICY and BOMB (haha),,,,,,,4,6/17/2020 22:26,https://untappd.com/c/907365942,https://untappd.com/beer/1444716,https://untappd.com/brewery/36968,United States,Hopewell Junction,NY,,,,907365942,1444716,36968,https://untappd.s3.amazonaws.com/photos/2020_06_18/42ff4750ca9571efb792d2912c8b3c4a_raw.jpg,3.99,3.99,,0,0
Chillswitch,Magic Hat Brewing Company,Wheat Beer - Other,6.4,45,sweet aroma and balanced taste of sweet malt and bitter hops. kinda like a blue moon and a classic ipa had a ~chill~ first date,,,,,,,3.5,6/21/2020 22:18,https://untappd.com/c/909332081,https://untappd.com/beer/2990601,https://untappd.com/brewery/812,United States,South Burlington,VT,,,,909332081,2990601,812,https://untappd.s3.amazonaws.com/photos/2020_06_22/a133bf4d421daafa9fbd6d74bbd7e04e_raw.jpg,3.48,3.49,,1,0
Mr. Soul,Magic Hat Brewing Company,Pale Ale - American,4.5,40,i mean it’s refreshing and good so id have it again but it’s not groundbreaking.,,,,,,,3.25,6/21/2020 22:50,https://untappd.com/c/909338767,https://untappd.com/beer/2993905,https://untappd.com/brewery/812,United States,South Burlington,VT,,,,909338767,2993905,812,https://untappd.s3.amazonaws.com/photos/2020_06_22/51c713fa669df864d56155806b2f513c_raw.jpg,3.46,3.47,,0,0
Summertime,Goose Island Beer Co.,Kölsch,5,20,not the best ive had but not the worst. v refreshing though.,,,,,,,3.25,6/22/2020 21:24,https://untappd.com/c/909524643,https://untappd.com/beer/1935,https://untappd.com/brewery/2898,United States,Chicago,IL,,,,909524643,1935,2898,https://untappd.s3.amazonaws.com/photos/2020_06_23/8b7b22f110a3a3e8924d4038c27ab819_raw.jpg,3.45,3.45,,1,0
Sona Gold Kolsch,Red Tank Brewing (New Jersey),Kölsch,5,0,better than the goose one,,,,,,,3.5,6/24/2020 22:11,https://untappd.com/c/910052620,https://untappd.com/beer/2109699,https://untappd.com/brewery/339947,United States,Red Bank,NJ,,,,910052620,2109699,339947,,3.49,3.54,,0,0
Blackberry / Cassis Hybrid Kolsch,Red Tank Brewing (New Jersey),Kölsch,6.2,0,color is amazing. the beginning taste is pleasant (blackberry) but it finishes more bitter (cassis). if it was less cassis id like this a lot more,,,,,,,3.25,6/25/2020 23:02,https://untappd.com/c/910390469,https://untappd.com/beer/3704747,https://untappd.com/brewery/339947,United States,Red Bank,NJ,,,,910390469,3704747,339947,https://untappd.s3.amazonaws.com/photos/2020_06_26/9d7f778b0537fd012b111c03ce340b2f_raw.jpg,3.7,3.69,,0,0
Moro Dat Creamsicle,Red Tank Brewing (New Jersey),Wheat Beer - American Pale Wheat,5.5,0,v wheaty. orange taste and a subtle vanilla taste at the end. feels like im actually having a creamsicle gee willickers 🤪,,,,,,,3.75,6/28/2020 22:42,https://untappd.com/c/911963569,https://untappd.com/beer/3682144,https://untappd.com/brewery/339947,United States,Red Bank,NJ,,,,911963569,3682144,339947,https://untappd.s3.amazonaws.com/photos/2020_06_29/cda7d08bab6b091a4f6420c0946caa0a_raw.jpg,3.79,3.74,,0,0
Haze Charmer,Tröegs Independent Brewing,Pale Ale - New England,5.5,0,"not a lot of aroma, but very refreshing and perfect level of bitterness and subtle sweetness. good summer brew (also cheers to being out for the first time)",Pier 13 - P13R,Hoboken,NJ,United States,40.7518,-74.0228,3.5,7/2/2020 14:45,https://untappd.com/c/912805276,https://untappd.com/beer/3674435,https://untappd.com/brewery/2583,United States,Hershey,PA,,,,912805276,3674435,2583,https://untappd.s3.amazonaws.com/photos/2020_07_02/33228ff6ec0a75510a76d94df3a5bcb2_raw.jpg,3.75,3.74,,1,0
BraufactuM Progusta,Radeberger Gruppe,IPA - International,6.8,50,v refreshing. I’m a fan.,Pilsener Haus & Biergarten,Hoboken,NJ,United States,40.7552,-74.0315,3.5,7/2/2020 16:50,https://untappd.com/c/912870209,https://untappd.com/beer/314318,https://untappd.com/brewery/4936,Germany,Frankfurt am Main,Hessen,,,,912870209,314318,4936,https://untappd.s3.amazonaws.com/photos/2020_07_02/1592d1dd29683d434c25f81ae0192d56_raw.jpg,3.62,3.62,,2,0
